domain,description,keywords
7bonkers.com,7Bonkers sells watches and related products.,"tomi watch, watch, customer service, customer, quality, bought, service, tomi, holiday, ornament, days, gift, products, christmas, week"
acegolfs.com,Acegolfs sells clothing and related products.,"regular price, usdsale price, priceunit price, usdregular priceunit, pants regular, jacket regular, sweatshirt regular, long sleeve, golf shirt, shirt quarterzip, premium sleeveless, price, ruffle golf, basic ruffle, sleeve quarterzip"
artisancutlery.net,Artisancutlery sells jewelry and related products.,"handle folding, folding knives, artisan cutlery, steel blade, titanium handle, usd, blade titanium, cutlery beest, unavailable, folding, handle, blade, unavailable artisan, knives, blade aluminum"
audienhearing.com,Audienhearing sells electronics and related products.,"johns hopkins, hopkins bloomberg, hopkins medicine, links dementia, public health, older adults, hearing, bloomberg school, study links, hearing loss, hopkins, johns, hidden risks, wearing hearing, dementia"
beecoolbikes.com,Beecoolbikes sells outdoor equipment and related products.,"peaking motor, rear suspension, terrain e-bikes, lockable fork, peaking, rear, bee, motor, full suspension, suspension, bike, fork, beecool, beecool bikes, bee adventurer"
bugmd.com,Bugmd sells pet supplies and related products.,"harsh chemicals, pest control, pest, control, harsh, chemicals, safe, pets, bugmd, guarantee, pests, bugs, chemicals family, eliminate, eliminate bugs"
carerspk.com,Carerspk sells beauty products and related products.,"free shipping, free, shipping, orders, order, days risk-free, risk-free trial, receive exclusive, exclusive deals, join, days, trial, receive, exclusive, deals"
clarifion.com,Clarifion sells electronics and related products.,"quiet ionization, air, air ionization, ionization, ionization technology, clarifion, whisper quiet, product designs, innovative technology, air ionizers, affordable pricing, technology, ionizers, release clarifion, technology eco-friendly"
cleanomicessentials.com,Cleanomicessentials sells beauty products and related products.,"sacrificing convenience, world, find sustainable, happy earth-lovers, everyday products, convenience, sustainable packaging, packaging solutions, planet, sustainable, fan favorites, happy, find, products, sacrificing"
collarsandco.com,Collarsandco sells clothing and related products.,"collection crafted, reserve collection, crafted details, dress collar, effortless presence, collar, polo, collar polo, dress, collection, crafted, patent pending, collar technology, reserve, polo shirt"
cosmicmonica.com,Cosmicmonica sells jewelry and related products.,"reading, monica, readings, verified customer, tarot, n’t, life, love, grateful clients, ’re, questions, psychic gift, clients, tarot reading, clarity"
cozybabywear.com,Cozybabywear sells toys and games and related products.,"return, return label, item, label, days, original, items, time frame, support page, package, page, return shipping, frame, condition, ’ll"
curtarra.com,Curtarra sells clothing and related products.,"curtains, semi sheer, curtarra, curtain, curtain designs, hardware curtarra, latest trends, pinch pleat, order, shades pinch, curtains linen, linen curtains, curtains semi, sheer curtains, curtains white"
drinkbrez.com,Drinkbrez sells beauty products and related products.,"denied important, access denied, customer accounts, store admin, alcohol alternatives, alternatives built, important, customer, inspiring alcohol, denied, customer based, store owner, enable customer, store, relieving"
funnyfuzzy.com,Funnyfuzzy sells pet supplies and related products.,"black friday, friday premium, limited stocks, biggest deals, stocks santa, santa paws, picks black, premium picks, friday, black, limited time, premium, limited, deals, home products"
gleefullsupps.com,Gleefullsupps sells beauty products and related products.,"support mood, energy gut, hormone support, free gifts, digestion health, gut health, save, bundle, short quiz, formulations tailored, free, gifts, mood, energy, digestion"
groundingwell.com,Groundingwell sells electronics and related products.,"catch fire, earth, grounding, healing power, earth healing, earth surface, power, electrons, fire, catch, grounding matters, excess electrons, explode, directly, ground"
hobbytron.com,Hobbytron sells toys and games and related products.,"handyman suitcase, spidey handyman, hobbytron, transformers, adventures founded, dancing robot, megatron dancing, hobbytron magical, robots bodhi, magical world, suitcase playset, robot watch, save, transformers dancing, watch megatron"
inpeaceful.com,Inpeaceful sells jewelry and related products.,"worldwide shipping, worldwide, shipping, tomorrow, chance, grab, prices, free shipping, day guarantee, natural solution, satisfied customers, free, inpeaceful, day, guarantee"
puranutrausa.com,Puranutrausa sells beauty products and related products.,"regular price, sale priceunit, priceunit price, pencil regular, double ended, price, lipstick regular, primer regular, shadow regular, concealer regular, balm regular, eyebrow pencil, retractable pencil, stick pencil, ended triangular"
cozytraildel.com,Cozytraildel sells jewelry and related products.,"regular price, sale priceunit, priceunit price, earrings regular, necklace regular, pendant earrings, women regular, price, bracelet regular, jewelry regular, simple green, simple design, women fashionable, women butterfly, unisex summer"
etherealing.com,Etherealing sells jewelry and related products.,"worldwide shipping, money back, back worldwide, shipping, results, money, worldwide, back spend, back, free shipping, day guarantee, natural solution, satisfied customers, customer reviews, free ebook"
yeyolento.com,Yeyolento sells beauty products and related products.,"regular price, tool regular, skin care, face mask, mask facial, facial mask, care tool, film regular, tissues regular, silicone face, silicone mask, facial skin, care moisturizing, women skin, non-woven face"
theearthlingco.com,Theearthlingco sells beauty products and related products.,"nature emelia, emelia wanted, feel good, nature, emelia, hair care, intentional, good, trust, health risks, wanted, feel, products, questionable ingredients, plastic waste"
truheightvitamins.com,Truheightvitamins sells toys and games and related products.,"targeted approach, science dna, growth, growth hormone, healthy growth, nba draft, jimmy butler, factors, tre mann, science, truheight, nba, targeted, approach, dna plays"
